{
  "schema": "codex-scientiae/article/0.1",
  "state": "source-ready",
  "slug": "2208.12435v1",
  "initialized_utc": "2026-08-26T03:56:42.898415Z",
  "title": "Comparing multiple latent space embeddings using topological analysis",
  "authors": [
    "Kisung You",
    "Ilmun Kim",
    "Ick Hoon Jin",
    "Minjeong Jeon",
    "Dennis Shung"
  ],
  "abstract": "The latent space model is one of the well-known methods for statistical inference of network data. While the model has been much studied for a single network, it has not attracted much attention to analyze collectively when multiple networks and their latent embeddings are present. We adopt a topology-based representation of latent space embeddings to learn over a population of network model fits, which allows us to compare networks of potentially varying sizes in an invariant manner to label permutation and rigid motion. This approach enables us to propose algorithms for clustering and multi-sample hypothesis tests by adopting well-established theories for Hilbert space-valued analysis. After the proposed method is validated via simulated examples, we apply the framework to analyze educational survey data from Korean innovative school reform.",
  "identifiers": {
    "arxiv": "2208.12435",
    "arxiv_versioned": "2208.12435v1",
    "doi": null,
    "external": {
      "arxiv": "2208.12435v1"
    }
  },
  "categories": [
    "stat.ME",
    "stat.AP"
  ],
  "concepts": [],
  "primary_category": "stat.ME",
  "published": "2022-08-26T04:51:12Z",
  "updated": "2022-08-26T04:51:12Z",
  "evidence": {
    "provider_metadata": [
      {
        "role": "api-metadata-bundle",
        "path": "2208.12435v1.api-metadata.json",
        "format": "application/vnd.codex-scientiae.deposit-metadata+json",
        "bytes": 7767,
        "sha256": "c3ce537c1de25f0ac7a893add99df0b3fcbbe639a4f41d751e0a7992f38ee0e0",
        "provider": "arxiv",
        "provider_roles": [
          "artifact-access",
          "artifact-origin",
          "metadata-authority"
        ],
        "artifact_provider": "arxiv",
        "artifact_provider_roles": [
          "artifact-access",
          "artifact-origin",
          "metadata-authority"
        ],
        "route": "artifact-provider",
        "fetched_at": "2026-08-26T03:56:41.603316Z",
        "response_url": "https://export.arxiv.org/api/query?id_list=2208.12435v1&max_results=1",
        "response_format": "application/atom+xml",
        "response_sha256": "268254b6b90a1f5822aac83b713a2d3b7b5e8d177f7003abc191d75c4a5f68ef"
      }
    ],
    "latex_source": {
      "entrypoint": "preprint.tex",
      "selection": "single-candidate",
      "declarations": {
        "title_tex": "Comparing multiple latent space embeddings using topological analysis",
        "authors_tex": [
          "Kisung You",
          "Ilmun Kim",
          "Ick Hoon Jin",
          "Minjeong Jeon",
          "Dennis Shung"
        ],
        "doi": null
      }
    },
    "package_control_files": [],
    "metadata_resolution": {
      "route": "artifact-provider",
      "artifact": {
        "provider": "arxiv",
        "identifier": "2208.12435v1",
        "provider_roles": [
          "artifact-access",
          "artifact-origin",
          "metadata-authority"
        ]
      },
      "selected_provider": "arxiv",
      "selected_provider_roles": [
        "artifact-access",
        "artifact-origin",
        "metadata-authority"
      ],
      "attempts": [
        {
          "provider": "arxiv",
          "status": "ok",
          "error": null
        }
      ]
    }
  },
  "source_forms": [
    {
      "role": "latex-source-archive",
      "path": "2208.12435v1.tar.gz",
      "format": "application/gzip",
      "bytes": 2280772,
      "sha256": "fba45007001354f29f4bb8bbd2df83cb8058a733cf32ac704b3114740d634087",
      "archive_kind": "tar+gzip"
    },
    {
      "role": "latex-source-tree",
      "path": "2208.12435v1-tex",
      "format": "application/x-latex-source-tree",
      "derived_from": "2208.12435v1.tar.gz",
      "entrypoint": "preprint.tex",
      "entrypoint_selection": "single-candidate",
      "files": 91,
      "tex_files": 1,
      "sha256": "e06f4d885ac0ea15d489de72f5e182f08e927f2eeebcb4377395d605403b74c1"
    },
    {
      "role": "pdf-source",
      "path": "2208.12435v1.pdf",
      "format": "application/pdf",
      "bytes": 2475163,
      "sha256": "daeef180f7d10be3bb84a25e6498f98534f53facf917fc125c53895e32079e2b"
    }
  ],
  "validation": {
    "status": "valid",
    "validated_utc": "2026-08-26T03:56:42.898415Z",
    "publication": "recovered-existing-tree",
    "checks": [
      {
        "name": "gzip-readable",
        "outcome": "passed",
        "archive_kind": "tar+gzip"
      },
      {
        "name": "archive-members-confined",
        "outcome": "passed",
        "entries": 92
      },
      {
        "name": "no-links-or-reparse-points",
        "outcome": "passed",
        "files": 91
      },
      {
        "name": "tex-valid-utf8",
        "outcome": "passed",
        "tex_files": 1
      },
      {
        "name": "entrypoint-unambiguous",
        "outcome": "passed",
        "selection": "single-candidate",
        "entrypoint": "preprint.tex"
      },
      {
        "name": "literal-inputs-resolved",
        "outcome": "passed",
        "unresolved_input_action": "Stop"
      },
      {
        "name": "document-environment-present",
        "outcome": "passed",
        "basis": "resolved-input-text"
      }
    ]
  }
}
